<?xml version="1.0" encoding="UTF-8"?>

<!DOCTYPE event SYSTEM "../../dtd/event.dtd">
<event lang="ja">
    <messages>
        <error>
            <time>時間のエラーがあります。</time>
            <unavailable>The following dates bellow are unavailable.</unavailable>
        </error>
        <check>赤い部分の情報を確かめてください。</check>
        <repeat-info>このイベントは繰り返し指定です。すべての情報は変更されます。</repeat-info>
        <other-user>このイベントは編集ができません。アカウント主は  </other-user>
    </messages>
    <new>イベントを作る</new>
    <edit>イベントの編集</edit>
    <save>保存</save>
    <delete>消去</delete>
    <cancel>取り消し</cancel>
    <user>所有者</user>
    <title>題名</title>
    <date>日付</date>
    <whole-day>終日</whole-day>
    <start>開始</start>
    <end>終了</end>
    <repeat>
        <title>繰り返し</title>
        <never>なし</never>
        <daily>毎日</daily>
        <weekly>毎週</weekly>
        <half-monthly>二週間に一回</half-monthly>
        <monthly>毎月</monthly>
        <yearly>毎年</yearly>
        <until>繰り返し終了</until>
    </repeat>
    <description>メモ</description>
</event>
