<?xml version="1.0" encoding="UTF-8"?>

<!DOCTYPE event SYSTEM "../../dtd/event.dtd">
<event lang="fr">
    <messages>
        <error>
            <time>L'heure de fin doit être supérieure à l'heure de début.</time>
            <unavailable>Les plages horaires ci-dessous sont indisponibles.</unavailable>
        </error>
        <check>Veuillez vérifier les champs en rouge</check>
        <repeat-info>Cet événement est répétitif. Toutes les occurences seront modifiées.</repeat-info>
        <other-user>Cet événement ne peut pas être modifié car il appartient à quelqu'un d'autre. </other-user>
    </messages>
    <new>Créer un événement</new>
    <edit>Modifier un événement</edit>
    <save>Enregistrer</save>
    <delete>Supprimer</delete>
    <cancel>Annuler</cancel>
    <user>Propriétaire</user>
    <title>Titre</title>
    <date>Date</date>
    <whole-day>Jour entier</whole-day>
    <start>Début</start>
    <end>Fin</end>
    <repeat>
        <title>Répéter</title>
        <never>Jamais</never>
        <daily>Chaque jour</daily>
        <weekly>Chaque semaine</weekly>
        <half-monthly>Toutes les deux semaines</half-monthly>
        <monthly>Chaque mois</monthly>
        <yearly>Chaque année</yearly>
        <until>Jusqu'au</until>
    </repeat>
    <description>Description</description>
</event>
